leelaz_opencl_tuning
0;XgemmBatched;128;100;128;16; -DKWG=32 -DKWI=2 -DMDIMA=32 -DMDIMC=32 -DMWG=64 -DNDIMB=8 -DNDIMC=8 -DNWG=16 -DSA=1 -DSB=1 -DSTRM=0 -DSTRN=0 -DVWM=2 -DVWN=2;OpenCL: AMD AMD Radeon R9 M395 Compute Engine @ 834MHz
